{
  "$schema": "http://json-schema.org/draft-07/schema#",
  "title": "Experience",
  "version": "1.0.0",
  "type": "object",
  "required": ["id", "title", "description", "category", "module"],
  "properties": {
    "id": { "type": "string", "pattern": "^[a-z0-9-]{3,32}$" },
    "title": { "type": "string", "minLength": 3, "maxLength": 80 },
    "description": { "type": "string", "minLength": 10, "maxLength": 300 },
    "category": {
      "type": "string",
      "enum": ["reflection", "game", "application", "interactive", "utility", "experiment", "documentation", "media", "future"]
    },
    "module": { "type": "string", "pattern": "^[a-z0-9-]+\\.ts$" },
    "tags": { "type": "array", "items": { "type": "string" }, "maxItems": 8 },
    "collection": { "type": "string" },
    "story": { "type": "string" },
    "version": { "type": "string", "default": "1.0.0" },
    "accessibility": {
      "type": "object",
      "properties": {
        "keyboard": { "type": "boolean" },
        "screenReader": { "type": "boolean" },
        "contrast": { "type": "boolean" }
      }
    }
  },
  "additionalProperties": false
}
