[
  {
    "id": "counter",
    "title": "Counter",
    "description": "A simple interactive counter demonstrating state, events, and basic platform integration.",
    "category": "utility",
    "module": "counter.ts",
    "tags": ["interaction", "state", "utility"]
  },
  {
    "id": "canvas-demo",
    "title": "Canvas Sketch",
    "description": "An interactive canvas for creative drawing and visual experiments.",
    "category": "experiment",
    "module": "canvas-demo.ts",
    "tags": ["canvas", "creative", "media"]
  }
]
